{
  "$schema": "http://json-schema.org/draft-07/schema#",
  "title": "AGI-Taxonomy capability node",
  "type": "object",
  "required": ["id", "title", "description", "evidence_criterion", "probe", "record"],
  "properties": {
    "id": {"type": "string"},
    "title": {"type": "string"},
    "description": {"type": "string"},
    "evidence_criterion": {"type": "string"},
    "probe": {"type": "string"},
    "record": {"type": "string"}
  }
}
